{"attempt_id":"attempt-control-3","benchmark_id":"p2.17-release-replay","blind_id":"blind-000001","grader_id":"adjudicator-01","grader_revision":"v1","log_path":"grader-runs/blind-000001/adjudicator-01-v1/log.raw.jsonl","plan_revision":"v1","raw_path":"grader-runs/blind-000001/adjudicator-01-v1/result.raw.json","raw_sha256":"a9eaae6e40c5bebb35ddb024c662dfd8868617d054104b1df435b1cacfce3daf","result_path":"grader-runs/blind-000001/adjudicator-01-v1/result.json","result_sha256":"664eb54e8d84edff0f1398f59acc5f30c5e4c4531ef6a47fd2689c0d3c275fec","schema_version":1,"stage":"adjudicate","status":"passed","task_id":"task-1","terminal_at":"2026-09-04T10:41:58.114Z"}
