{"attempt_id":"attempt-candidate-2","benchmark_id":"p2.17-release-replay","blind_id":"blind-000006","grader_id":"adjudicator-01","grader_revision":"v1","log_path":"grader-runs/blind-000006/adjudicator-01-v1/log.raw.jsonl","plan_revision":"v1","raw_path":"grader-runs/blind-000006/adjudicator-01-v1/result.raw.json","raw_sha256":"5ca54d85fe72e2f74900efdc4acab4ced8cc2cc708c155e632b99553ee679193","result_path":"grader-runs/blind-000006/adjudicator-01-v1/result.json","result_sha256":"d5605cc78892b670b9b13c7bd15910fd14e542cdfbcd6b33345a8c55f3f071ab","schema_version":1,"stage":"adjudicate","status":"passed","task_id":"task-1","terminal_at":"2026-09-04T08:32:39.815Z"}
